{
  "$schema": "https://json-schema.org/draft/2020-12/schema",
  "$id": "https://aegis.invalid/contracts/ScannerGuardSetV1.json",
  "title": "ScannerGuardSetV1",
  "type": "object",
  "additionalProperties": false,
  "properties": {
    "schema_version": {
      "type": "string",
      "const": "1.0"
    },
    "protocol": {
      "type": "string",
      "const": "absolute-deadline-v1"
    },
    "linux_amd64": {
      "type": "string",
      "pattern": "^sha256:[0-9a-f]{64}$"
    },
    "linux_arm64": {
      "type": "string",
      "pattern": "^sha256:[0-9a-f]{64}$"
    },
    "guard_set_digest": {
      "type": "string",
      "pattern": "^sha256:[0-9a-f]{64}$"
    }
  },
  "required": [
    "schema_version",
    "protocol",
    "linux_amd64",
    "linux_arm64",
    "guard_set_digest"
  ]
}
